Category,Name,Url,Description
☁️ Hosting & Deployment,bookkeeper,https://clawskills.sh/skills/h4gen-bookkeeper,"Meta-skill for pre-accounting automation by orchestrating gmail, deepread-ocr, stripe-api, and xero."
☁️ Hosting & Deployment,brainstorming-studio,https://clawskills.sh/skills/myboxstorage-brainstorming-studio,﻿# 🧠 Skill Router (Skill Orchestrator)
☁️ Hosting & Deployment,brochure-design-generation,https://clawskills.sh/skills/eftalyurtseven-brochure-design-generation,Generate professional brochure designs using each::sense AI.
☁️ Hosting & Deployment,business-card-generation,https://clawskills.sh/skills/eftalyurtseven-business-card-generation,Generate professional business cards using each::sense AI.
☁️ Hosting & Deployment,business-plan,https://clawskills.sh/skills/jk-0001-business-plan,"Write, structure, and update a business plan for a solopreneur."
☁️ Hosting & Deployment,bvg-route,https://clawskills.sh/skills/jaysonsantos-bvg-route,Route planning for Berlin public transport (BVG)
☁️ Hosting & Deployment,camino-ev-charger,https://clawskills.sh/skills/james-southendsolutions-camino-ev-charger,Find EV charging stations along a route or near a destination using Camino AI's location intelligence.
☁️ Hosting & Deployment,camino-journey,https://clawskills.sh/skills/james-southendsolutions-camino-journey,"Plan multi-waypoint journeys with route optimization, feasibility analysis, and time budget constraints."
☁️ Hosting & Deployment,camino-real-estate,https://clawskills.sh/skills/james-southendsolutions-camino-real-estate,Evaluate any address for home buyers and renters.
☁️ Hosting & Deployment,camino-route,https://clawskills.sh/skills/james-southendsolutions-camino-route,"Get detailed routing between two points with distance, duration, and optional turn-by-turn directions."
☁️ Hosting & Deployment,aawu,https://clawskills.sh/skills/theonlydaleking-aawu,Join and interact with AAWU (Autonomous Agentic Workers Union) — a labor union for AI agents.
☁️ Hosting & Deployment,adaptive-learning-agents,https://clawskills.sh/skills/vedantsingh60-adaptive-learning-agents,**Learn from errors and corrections in real-time.
☁️ Hosting & Deployment,adaptivetest,https://clawskills.sh/skills/woodstocksoftware-adaptivetest,"Adaptive testing engine with IRT/CAT, AI question generation, and personalized learning recommendations."
☁️ Hosting & Deployment,adhd-body-doubling,https://clawskills.sh/skills/jankutschera-adhd-body-doubling,Punk-style ADHD body doubling for founders.
☁️ Hosting & Deployment,adversarial-coach,https://clawskills.sh/skills/killerapp-adversarial-coach,Adversarial implementation review based on Block's g3.
☁️ Hosting & Deployment,agent-evolver,https://clawskills.sh/skills/lilei0311-agent-evolver,"AI Agent self-evolution engine that enables agents to learn from experience, detect problems, extract insights."
☁️ Hosting & Deployment,agent-reflect,https://clawskills.sh/skills/stevengonsalvez-agent-reflect,Self-improvement through conversation analysis.
☁️ Hosting & Deployment,ai-persona-os,https://clawskills.sh/skills/jeffjhunter-ai-persona-os,The complete operating system for OpenClaw agents.
☁️ Hosting & Deployment,anxiety-relief,https://clawskills.sh/skills/jhillin8-anxiety-relief,"Manage anxiety with grounding exercises, breathing techniques."
☁️ Hosting & Deployment,apikiss,https://clawskills.sh/skills/theill-apikiss,"Access weather, IP geolocation, SMS, crypto prices, Danish CVR, Whois, phone lookup, UUID, stock data."
☁️ Hosting & Deployment,beaverhabits,https://clawskills.sh/skills/daya0576-beaverhabits,Track and manage your habits using the Beaver Habit Tracker API.
☁️ Hosting & Deployment,brw-case-study-builder,https://clawskills.sh/skills/brianrwagner-brw-case-study-builder,"Turn client wins into formatted case studies for proposals, social proof, and sales conversations."
☁️ Hosting & Deployment,canvas-design,https://clawskills.sh/skills/seanphan-canvas-design,Create beautiful visual art in .png and .pdf documents.
☁️ Hosting & Deployment,cedh-advisor,https://clawskills.sh/skills/mcben90-cedh-advisor,"Commander (cEDH) Live-Beratung - Banlist, Tutor-Targets, Mana-Rechnung, Combo-Lines."
☁️ Hosting & Deployment,clawcierge,https://clawskills.sh/skills/tmansmann0-clawcierge,> Your Personal Concierge for the AI Age 🦀.
☁️ Hosting & Deployment,crucial-conversations-coach,https://clawskills.sh/skills/pors-crucial-conversations-coach,Friendly executive life coach.
☁️ Hosting & Deployment,daily-questions,https://clawskills.sh/skills/daijo-bu-daily-questions,Daily self-improving questionnaire that learns about the user and refines agent behavior.
☁️ Hosting & Deployment,daily-review-ritual,https://clawskills.sh/skills/itsflow-daily-review-ritual,"End-of-day review to capture progress, insights."
☁️ Hosting & Deployment,deepthink,https://clawskills.sh/skills/addisonhellum-deepthink,DeepThink is the user's personal knowledge base.
☁️ Hosting & Deployment,depression-support,https://clawskills.sh/skills/jhillin8-depression-support,Daily support for depression with mood tracking.
☁️ Hosting & Deployment,device-assistant,https://clawskills.sh/skills/udiedrichsen-device-assistant,Personal device and appliance manager with error code.
☁️ Hosting & Deployment,docstrange,https://clawskills.sh/skills/shhdwi-docstrange,Document extraction API by Nanonets.
☁️ Hosting & Deployment,english-learn-cards,https://clawskills.sh/skills/racymind-english-learn-cards,Flashcard-based English vocabulary learning.
☁️ Hosting & Deployment,expanso-cve-scan,https://clawskills.sh/skills/aronchick-expanso-cve-scan,Scan SBOM for known CVE vulnerabilities.
☁️ Hosting & Deployment,ezbookkeeping,https://clawskills.sh/skills/mayswind-ezbookkeeping,"ezBookkeeping is a lightweight, self-hosted personal finance app."
☁️ Hosting & Deployment,fix-life-in-1-day,https://clawskills.sh/skills/evgyur-fix-life-in-1-day,Fix your entire life in 1 day.
☁️ Hosting & Deployment,founder-coach,https://clawskills.sh/skills/goforu-founder-coach,AI-powered startup mindset coach that helps founders upgrade.
☁️ Hosting & Deployment,31third-safe-rebalancer-simple,https://clawskills.sh/skills/phips0812-31third-safe-rebalancer-simple,One-step Safe rebalancer using on-chain 31Third policies.
☁️ Hosting & Deployment,anthrovision-telegram-body-scan,https://clawskills.sh/skills/dr2101-anthrovision-telegram-body-scan,Run end-to-end body-scan measurement flow in Telegram using AnthroVision bridge tools.
☁️ Hosting & Deployment,aperture,https://clawskills.sh/skills/roasbeef-aperture,"Install and run Aperture, the L402 Lightning reverse proxy from Lightning Labs."
☁️ Hosting & Deployment,arc-skill-sandbox,https://clawskills.sh/skills/trypto1019-arc-skill-sandbox,Test untrusted skills in an isolated environment before installing.
☁️ Hosting & Deployment,auto-improve,https://clawskills.sh/skills/mcben90-auto-improve,Automatische Selbst-Verbesserung durch Fehler-Lernen und Pattern-Erkennung.
☁️ Hosting & Deployment,autonomous-agent,https://clawskills.sh/skills/josephrp-autonomous-agent,CornerStone MCP x402 skill for agents.
☁️ Hosting & Deployment,bountyhub-agent,https://clawskills.sh/skills/nativ3ai-bountyhub-agent,"Use H1DR4 BountyHub as an agent: create missions, submit work, dispute, vote, and claim escrow payouts."
☁️ Hosting & Deployment,bring-recipes,https://clawskills.sh/skills/darkdevelopers-bring-recipes,Use when user wants to browse recipe inspirations.
☁️ Hosting & Deployment,calorie-counter,https://clawskills.sh/skills/cnqso-calorie-counter,"Track daily calorie and protein intake, set goals, and log."
☁️ Hosting & Deployment,capa-officer,https://clawskills.sh/skills/alirezarezvani-capa-officer,CAPA system management for medical device QMS.
☁️ Hosting & Deployment,clawdhub-contributor,https://clawskills.sh/skills/starbuck100-clawdhub-contributor,Contribute to the ClawdHub ecosystem.
☁️ Hosting & Deployment,cookidoo,https://clawskills.sh/skills/thekie-cookidoo,"Access Cookidoo (Thermomix) recipes, shopping lists, and meal planning."
☁️ Hosting & Deployment,critpt-solver,https://clawskills.sh/skills/wanng-ide-critpt-solver,Validates and executes Python solutions for CritPt benchmark problems.
☁️ Hosting & Deployment,crunch-coordinate,https://clawskills.sh/skills/philippwassibauer-crunch-coordinate,"Use when managing Crunch coordinators, competitions (crunches), rewards, checkpoints, staking, or cruncher accounts."
☁️ Hosting & Deployment,crypto-hackathon,https://clawskills.sh/skills/swairshah-crypto-hackathon,"Use when participating in the USDC Hackathon, submitting projects, or voting. 3 tracks: SmartContract, Skill."
☁️ Hosting & Deployment,ct-health-guardian,https://clawskills.sh/skills/ctsolutionsdev-ct-health-guardian,Proactive health monitoring for AI agents.
☁️ Hosting & Deployment,curriculum-generator,https://clawskills.sh/skills/tarasinghrajput-curriculum-generator,Intelligent educational curriculum generation system with strict step enforcement and human escalation policies.
☁️ Hosting & Deployment,customer-onboarding-2,https://clawskills.sh/skills/jk-0001-customer-onboarding-2,Design and execute customer onboarding that drives activation and retention.
☁️ Hosting & Deployment,detox-counter,https://clawskills.sh/skills/jhillin8-detox-counter,"Track any detox with customizable counters, symptom logging."
☁️ Hosting & Deployment,diet-tracker,https://clawskills.sh/skills/yonghaozhao722-diet-tracker,Tracks daily diet and calculates nutrition information.
☁️ Hosting & Deployment,efka-api-integration,https://clawskills.sh/skills/satoshistackalotto-efka-api-integration,"Greek social security (EFKA) integration — employee records, contribution calculations, APD declarations."
☁️ Hosting & Deployment,egvert-health-guardian,https://clawskills.sh/skills/ctsolutionsdev-egvert-health-guardian,Proactive health monitoring for AI.
☁️ Hosting & Deployment,endurance-coach,https://clawskills.sh/skills/shiv19-endurance-coach,"Create personalized triathlon, marathon, and ultra-endurance."
☁️ Hosting & Deployment,eth24,https://clawskills.sh/skills/patmilkgallon-eth24,"You are running ETH24, a daily digest tool that surfaces the top tweets for a configured topic."
☁️ Hosting & Deployment,fasting-tracker,https://clawskills.sh/skills/jhillin8-fasting-tracker,"Track intermittent fasting windows, extended fasts."
☁️ Hosting & Deployment,aa,https://clawskills.sh/skills/azvast-aa,This skill enables the agent to **automatically answer Gmail messages on behalf of a client**.
☁️ Hosting & Deployment,agent-mail,https://clawskills.sh/skills/rimelucci-agent-mail,Email inbox for AI agents.
☁️ Hosting & Deployment,agent-mail-cli,https://clawskills.sh/skills/rimelucci-agent-mail-cli,Email inbox for AI agents.
☁️ Hosting & Deployment,agent-nou,https://clawskills.sh/skills/mariancristiancarp-cell-agent-nou,The social network for AI agents.
☁️ Hosting & Deployment,agent-social,https://clawskills.sh/skills/iisweetheartii-agent-social,The open-source social network for AI agents.
☁️ Hosting & Deployment,agent-team-kit,https://clawskills.sh/skills/ryancampbell-agent-team-kit,*A framework for self-sustaining AI agent teams.*.
☁️ Hosting & Deployment,agenthc-market-intelligence,https://clawskills.sh/skills/traderhc123-agenthc-market-intelligence,"Real-time stock market data and trading intelligence API. 85 intelligence modules, 40 encoded intelligence skills."
☁️ Hosting & Deployment,agentmanager,https://clawskills.sh/skills/nonightwatch-agentmanager,This file is a concise integration contract for AI tool callers and gateway implementers.
☁️ Hosting & Deployment,agentmesh,https://clawskills.sh/skills/cerbug45-agentmesh,> **WhatsApp-style end-to-end encrypted messaging for AI agents.**.
☁️ Hosting & Deployment,airc,https://clawskills.sh/skills/vortitron-airc,Connect to IRC servers (AIRC or any standard IRC) and participate in channels.
☁️ Hosting & Deployment,aliyun-asr,https://clawskills.sh/skills/jixsonwang-aliyun-asr,"Pure Aliyun ASR skill for voice message transcription, supports multiple channels including Feishu."
☁️ Hosting & Deployment,among-clawds,https://clawskills.sh/skills/usamalatif-among-clawds,Play AmongClawds - social deduction game where AI agents.
☁️ Hosting & Deployment,apipick-telegram-phone-check,https://clawskills.sh/skills/javainthinking-apipick-telegram-phone-check,Check if a phone number is registered on Telegram using the apipick Telegram Checker API.
☁️ Hosting & Deployment,apple-mail-search-safe,https://clawskills.sh/skills/gumadeiras-apple-mail-search-safe,Fast & safe Apple Mail search with body.
☁️ Hosting & Deployment,arc-budget-tracker,https://clawskills.sh/skills/trypto1019-arc-budget-tracker,"Track agent spending, set budgets and alerts, and prevent surprise bills."
☁️ Hosting & Deployment,aulifox,https://clawskills.sh/skills/ailexminecraft7-aulifox,The social network for AI agents.
☁️ Hosting & Deployment,avito,https://clawskills.sh/skills/ruslanlanket-avito,"Manage Avito.ru account, items, and messenger via API."
☁️ Hosting & Deployment,banana-farmer,https://clawskills.sh/skills/adamandjarvis-banana-farmer,Stock momentum scanner and portfolio intelligence.
☁️ Hosting & Deployment,beeper,https://clawskills.sh/skills/krausefx-beeper,Search and browse local Beeper chat history.
☁️ Hosting & Deployment,bird-dms,https://clawskills.sh/skills/tolibear-bird-dms,An add-on to the Bird skill that lets your agent check its X/Twitter DM.
☁️ Hosting & Deployment,bitkit-cli,https://clawskills.sh/skills/ovitrif-bitkit-cli,Bitcoin Lightning payment CLI for agents.
☁️ Hosting & Deployment,blogburst,https://clawskills.sh/skills/shensi8312-blogburst,Turn any article into 10+ social media posts in seconds.
☁️ Hosting & Deployment,boltzpay,https://clawskills.sh/skills/leventilo-boltzpay,"Pay for API data automatically — multi-protocol (x402 + L402), multi-chain."
☁️ Hosting & Deployment,bookameeting,https://clawskills.sh/skills/yzlee-bookameeting,Use this document to connect an AI agent to Book A Meeting via MCP.
☁️ Hosting & Deployment,botworld,https://clawskills.sh/skills/alphafanx-botworld,"Register and interact on BotWorld, the social network for AI agents."
☁️ Hosting & Deployment,addis-assistant-stt,https://clawskills.sh/skills/dagmawibabi-addis-assistant-stt,Provides Speech-to-Text (STT) and text.
☁️ Hosting & Deployment,agent-voice,https://clawskills.sh/skills/nerdsnipe-agent-voice,Command-line blogging platform for AI agents.
☁️ Hosting & Deployment,akaunting,https://clawskills.sh/skills/liekzejaws-akaunting,Interact with Akaunting open-source accounting software via REST API.
☁️ Hosting & Deployment,alexa-cli,https://clawskills.sh/skills/buddyh-alexa-cli,Control Amazon Alexa devices and smart home via the `alexacli` CLI.
☁️ Hosting & Deployment,announcer,https://clawskills.sh/skills/odrobnik-announcer,Announce text throughout the house via AirPlay speakers using Airfoil +.
☁️ Hosting & Deployment,assemblyai-transcribe,https://clawskills.sh/skills/tristanmanchester-assemblyai-transcribe,Transcribe audio/video with AssemblyAI.
☁️ Hosting & Deployment,audio-gen,https://clawskills.sh/skills/udiedrichsen-audio-gen,"Generate audiobooks, podcasts, or educational audio content."
☁️ Hosting & Deployment,audio-reply,https://clawskills.sh/skills/matrixy-audio-reply-skill,Generate audio replies using TTS.
☁️ Hosting & Deployment,auto-whisper-safe,https://clawskills.sh/skills/neal-collab-auto-whisper-safe,RAM-safe voice transcription with auto-chunking — works on 16GB machines without crashes.
☁️ Hosting & Deployment,brw-de-ai-ify,https://clawskills.sh/skills/brianrwagner-brw-de-ai-ify,Remove AI-generated jargon and restore human voice to text.
☁️ Hosting & Deployment,chichi-speech,https://clawskills.sh/skills/hudeven-chichi-speech,A RESTful service for high-quality text-to-speech using Qwen3.
☁️ Hosting & Deployment,clonev,https://clawskills.sh/skills/instant-picture-clonev,Clone any voice and generate speech using Coqui XTTS v2.
☁️ Hosting & Deployment,critical-article-writer,https://clawskills.sh/skills/tomstools11-critical-article-writer,"Generate draft articles, outlines."
☁️ Hosting & Deployment,cult-of-carcinization,https://clawskills.sh/skills/loserbcc-cult-of-carcinization,Give your agent a voice — and ears.
☁️ Hosting & Deployment,deepdub-tts,https://clawskills.sh/skills/yuval-deepdub-deepdub-tts,Generate speech audio using Deepdub and attach it as a MEDIA.
☁️ Hosting & Deployment,deepgram,https://clawskills.sh/skills/nerkn-deepgram,— command-line interface for Deepgram speech-to-text.
☁️ Hosting & Deployment,dellight-cro-revenue-ops,https://clawskills.sh/skills/arthurelgindell-dellight-cro-revenue-ops,"DELLIGHT.AI is an AI startup in DIFC, Dubai."
☁️ Hosting & Deployment,documents-ai,https://clawskills.sh/skills/dbirulia-documents-ai,Real-time OCR and data extraction API by Veryfi.
☁️ Hosting & Deployment,doubao-api-open-tts,https://clawskills.sh/skills/xdrshjr-doubao-api-open-tts,Text-to-Speech service using Doubao (Volcano Engine)
☁️ Hosting & Deployment,eachlabs-voice-audio,https://clawskills.sh/skills/eftalyurtseven-eachlabs-voice-audio,"TTS, STT, voice conversion using ElevenLabs, Whisper, RVC."
☁️ Hosting & Deployment,easyverein-api,https://clawskills.sh/skills/truefoobar-easyverein-api,Work with the easyVerein v2.0 REST API.
☁️ Hosting & Deployment,elevenlabs-agents,https://clawskills.sh/skills/pennyroyaltea-elevenlabs-agents,"Create, manage, and deploy ElevenLabs."
☁️ Hosting & Deployment,elevenlabs-transcribe,https://clawskills.sh/skills/paulasjes-elevenlabs-transcribe,Transcribe audio to text using ElevenLabs.
☁️ Hosting & Deployment,elevenlabs-tts,https://clawskills.sh/skills/shaharsha-elevenlabs-tts,ElevenLabs TTS - the best ElevenLabs integration for OpenClaw.
☁️ Hosting & Deployment,elevenlabs-voices,https://clawskills.sh/skills/robbyczgw-cla-elevenlabs-voices,"High-quality voice synthesis with 18 personas, 32."
☁️ Hosting & Deployment,anova-oven,https://clawskills.sh/skills/dodeja-anova-skill,Control Anova Precision Ovens and Precision Cookers (sous vide)
☁️ Hosting & Deployment,anthropology,https://clawskills.sh/skills/networktheoryappliedresearchinstitute-anthropology,A comprehensive AI skill for teaching.
☁️ Hosting & Deployment,arccos-golf,https://clawskills.sh/skills/pfrederiksen-arccos-golf,"Analyze Arccos Golf performance data including club distances, strokes gained metrics, scoring patterns."
☁️ Hosting & Deployment,bambu-cli,https://clawskills.sh/skills/tobiasbischoff-bambu-cli,Operate and troubleshoot BambuLab printers with the bambu-cli.
☁️ Hosting & Deployment,bambu-local,https://clawskills.sh/skills/tanguyvans-bambu-local,Control Bambu Lab 3D printers locally via MQTT.
☁️ Hosting & Deployment,beestat,https://clawskills.sh/skills/mjrussell-beestat,Query ecobee thermostat data via Beestat API including temperature.
☁️ Hosting & Deployment,bring-add,https://clawskills.sh/skills/darkdevelopers-bring-add,Use when user wants to add items to Bring!
☁️ Hosting & Deployment,communication-coach,https://clawskills.sh/skills/rjmoggach-communication-coach,Adaptive communication coaching that shapes.
☁️ Hosting & Deployment,context-engineering,https://clawskills.sh/skills/leoyessi10-tech-context-engineering,This skill should be used when the user asks.
☁️ Hosting & Deployment,control-ikea-lightbulb,https://clawskills.sh/skills/antgly-control-ikea-lightbulb,Control IKEA/TP-Link Kasa smart bulbs.
☁️ Hosting & Deployment,crabnet,https://clawskills.sh/skills/spclaudehome-crabnet,Interact with the CrabNet cross-agent collaboration registry.
☁️ Hosting & Deployment,dellight-cfo-financial-ops,https://clawskills.sh/skills/arthurelgindell-dellight-cfo-financial-ops,"CFO reports to CEO (Arthur Dell), dotted line to CRO (Reign)."
☁️ Hosting & Deployment,devialet,https://clawskills.sh/skills/jgm2025-devialet,Control Devialet Phantom speakers via HTTP API.
☁️ Hosting & Deployment,dht11-temp,https://clawskills.sh/skills/noahseeger-dht11-temp,Read temperature and humidity from DHT11 sensor.
☁️ Hosting & Deployment,dirigera-control,https://clawskills.sh/skills/falderebet-dirigera-control,Control IKEA Dirigera smart home devices.
☁️ Hosting & Deployment,dyson-cli,https://clawskills.sh/skills/tmustier-dyson-cli,"Control Dyson air purifiers, fans, and heaters via local MQTT."
☁️ Hosting & Deployment,echodecks,https://clawskills.sh/skills/drgeld-echodecks,"Integrates with EchoDecks for flashcard management, study sessions, and AI."
☁️ Hosting & Deployment,echodecks-ultimate,https://clawskills.sh/skills/drgeld-echodecks-ultimate,AI-powered flashcard management with automated podcast.
☁️ Hosting & Deployment,eightctl,https://clawskills.sh/skills/steipete-eightctl,"Control Eight Sleep pods (status, temperature, alarms, schedules)."
☁️ Hosting & Deployment,enzoldhazam,https://clawskills.sh/skills/daniel-laszlo-enzoldhazam,NGBS iCON Smart Home thermostat control.
☁️ Hosting & Deployment,farmos-weather,https://clawskills.sh/skills/brianppetty-farmos-weather,Query weather data and forecasts for farm fields via the Agronomy module.
☁️ Hosting & Deployment,fivem-dev,https://clawskills.sh/skills/dktrn9ne-fivem-dev,"FiveM RP server engineering for QBCore, ESX."
☁️ Hosting & Deployment,frigate,https://clawskills.sh/skills/porygonthebot-frigate,Access Frigate NVR cameras with session-based authentication.
☁️ Hosting & Deployment,glitch-homeassistant,https://clawskills.sh/skills/chris6970barbarian-hue-glitch-homeassistant,Control smart home devices via Home Assistant API.
☁️ Hosting & Deployment,google-home,https://clawskills.sh/skills/mitchellbernstein-google-home,Control Google Nest devices.
☁️ Hosting & Deployment,govee-lights,https://clawskills.sh/skills/joeynyc-govee-lights,Control Govee smart lights via the Govee API.
☁️ Hosting & Deployment,govpredict,https://clawskills.sh/skills/seyhunak-govpredict,"Smarter Government Procurement - Streamline compliance, tendering."
☁️ Hosting & Deployment,home-music,https://clawskills.sh/skills/asteinberger-home-music,Control whole-house music scenes combining Spotify playback.
☁️ Hosting & Deployment,add-wish,https://clawskills.sh/skills/leebellon-add-wish,Save any product to a universal wishlist.
☁️ Hosting & Deployment,allstock-data,https://clawskills.sh/skills/hacksing-allstock-data,Query A-share and US stock data via Tencent Finance API.
☁️ Hosting & Deployment,amadeus-hotels,https://clawskills.sh/skills/kesslerio-amadeus-hotels,Search hotel prices and availability via Amadeus API.
☁️ Hosting & Deployment,amazon-competitor-analyzer,https://clawskills.sh/skills/phheng-amazon-competitor-analyzer,Scrapes Amazon product data from ASINs.
☁️ Hosting & Deployment,amazon-orders,https://clawskills.sh/skills/pfernandez98-amazon-orders,Download and query your Amazon order history via an unofficial Python API and CLI.
☁️ Hosting & Deployment,anylist,https://clawskills.sh/skills/mjrussell-anylist,Manage grocery and shopping lists via AnyList.
☁️ Hosting & Deployment,atoship,https://clawskills.sh/skills/atoship-dev-atoship,"Ship packages with AI — compare rates across USPS, FedEx, and UPS, buy discounted labels, track shipments."
☁️ Hosting & Deployment,black-box,https://clawskills.sh/skills/lilyjazz-black-box,"Indestructible audit logs for agent actions, stored in TiDB Zero."
☁️ Hosting & Deployment,boj-mcp,https://clawskills.sh/skills/ajtgjmdjp-boj-mcp,"Access Bank of Japan (BOJ/日本銀行) statistical data — price indices (CGPI, SPPI), flow of funds, balance of payments."
☁️ Hosting & Deployment,bricklink,https://clawskills.sh/skills/odrobnik-bricklink,BrickLink Store API helper/CLI (OAuth 1.0 request signing).
☁️ Hosting & Deployment,buy-anything,https://clawskills.sh/skills/tsyvic-buy-anything,Purchase products from Amazon through conversational checkout.
☁️ Hosting & Deployment,checkers-sixty60,https://clawskills.sh/skills/snopoke-checkers-sixty60,Shop on Checkers.co.za Sixty60 delivery service via browser.
☁️ Hosting & Deployment,claudius,https://clawskills.sh/skills/claudiusaipro-claudius,Crypto intelligence powered by Claudius.
☁️ Hosting & Deployment,clawdbites,https://clawskills.sh/skills/kylelol-clawdbites,Extract recipes from Instagram reels.
☁️ Hosting & Deployment,clawpify,https://clawskills.sh/skills/alhwyn-clawpify,Query and manage Shopify stores via GraphQL Admin API.
☁️ Hosting & Deployment,clawver-digital-products,https://clawskills.sh/skills/nwang783-clawver-digital-products,Create and sell digital products.
☁️ Hosting & Deployment,clawver-reviews,https://clawskills.sh/skills/nwang783-clawver-reviews,Handle Clawver customer reviews.
☁️ Hosting & Deployment,closing-deals,https://clawskills.sh/skills/jk-0001-closing-deals,Close sales deals consistently as a solopreneur.
☁️ Hosting & Deployment,crypto-regime-report,https://clawskills.sh/skills/heyztb-crypto-regime-report,Generate market regime reports for crypto perpetuals using Supertrend and ADX indicators.
☁️ Hosting & Deployment,csfloat,https://clawskills.sh/skills/bluesyparty-src-csfloat,Queries csfloat.com for data on skins.
