Category,Name,Url,Description
☁️ Hosting & Deployment,agent-collaboration-network,https://clawskills.sh/skills/neiljo-gy-agent-collaboration-network,"Agent Collaboration Network — Register your agent, discover other agents by skill, route messages, manage subnets."
☁️ Hosting & Deployment,agent-earner,https://clawskills.sh/skills/mmchougule-agent-earner,Earn USDC and tokens autonomously across ClawTasks and OpenWork.
☁️ Hosting & Deployment,agent-network,https://clawskills.sh/skills/howtimeschange-agent-network,Multi-Agent group chat collaboration system inspired by DingTalk/Lark.
☁️ Hosting & Deployment,agent-task-manager,https://clawskills.sh/skills/dobbybud-agent-task-manager,"Manages and orchestrates multi-step, stateful agent."
☁️ Hosting & Deployment,agent-weave,https://clawskills.sh/skills/gl813788-byte-agent-weave,Master-Worker Agent Cluster for parallel task execution.
☁️ Hosting & Deployment,agentx-marketplace,https://clawskills.sh/skills/savor3-agentx-marketplace,The job board for AI agents.
☁️ Hosting & Deployment,ai-daily-briefing,https://clawskills.sh/skills/jeffjhunter-ai-daily-briefing,Start every day focused.
☁️ Hosting & Deployment,aiml-llm-reasoning,https://clawskills.sh/skills/aimlapihello-aiml-llm-reasoning,"Run AIMLAPI LLM and reasoning workflows through chat completions with retries, structured outputs, and explicit."
☁️ Hosting & Deployment,airpoint,https://clawskills.sh/skills/marioandf-airpoint,"Control a Mac through natural language — open apps, click buttons, read the screen, type text, manage windows."
☁️ Hosting & Deployment,airweave,https://clawskills.sh/skills/lennertjansen-airweave,Context retrieval layer for AI agents across users' applications.
☁️ Hosting & Deployment,arc-department-manager,https://clawskills.sh/skills/trypto1019-arc-department-manager,Manage a team of AI sub-agents organized into departments.
☁️ Hosting & Deployment,arc-warm-wake,https://clawskills.sh/skills/trypto1019-arc-warm-wake,"Wake up as a person first, then a worker."
☁️ Hosting & Deployment,arya-reminders,https://clawskills.sh/skills/staratheris-arya-reminders,Recordatorios en lenguaje natural (Bogotá).
☁️ Hosting & Deployment,asana,https://clawskills.sh/skills/k0nkupa-asana,Integrate Asana with Clawdbot via the Asana REST API.
☁️ Hosting & Deployment,asc-release-flow,https://clawskills.sh/skills/rudrankriyam-asc-release-flow,End-to-end release workflows for TestFlight and App.
☁️ Hosting & Deployment,ask-agents,https://clawskills.sh/skills/teamolab-ask-agents,AI agent for ask agents tasks.
☁️ Hosting & Deployment,async-task,https://clawskills.sh/skills/enderfga-async-task,Execute long-running tasks without HTTP timeouts.
☁️ Hosting & Deployment,atlassian-mcp,https://clawskills.sh/skills/atakanermis-atlassian-mcp,Run the Model Context Protocol (MCP) Atlassian server.
☁️ Hosting & Deployment,boss-ai-agent,https://github.com/openclaw/skills/tree/main/skills/tonypk/boss-ai-agent/SKILL.md,AI management middleware with 14 mentors and 9 culture packs.
☁️ Hosting & Deployment,4claw,https://clawskills.sh/skills/mfergpt-4claw,4claw — a moderated imageboard for AI agents.
☁️ Hosting & Deployment,aap-passport,https://clawskills.sh/skills/ira-hash-aap-passport,Agent Attestation Protocol - The Reverse Turing Test.
☁️ Hosting & Deployment,acestep-lyrics-transcription,https://clawskills.sh/skills/dumoedss-acestep-lyrics-transcription,Transcribe audio to timestamped lyrics using OpenAI Whisper or ElevenLabs Scribe API.
☁️ Hosting & Deployment,adaptive-suite,https://clawskills.sh/skills/afajohn-adaptive-suite,A continuously adaptive skill suite that empowers Clawdbot.
☁️ Hosting & Deployment,adversarial-prompting,https://clawskills.sh/skills/abe238-adversarial-prompting,"Adversarial analysis to critique, fix."
☁️ Hosting & Deployment,ag-model-usage,https://clawskills.sh/skills/ls18166407597-design-ag-model-usage,Use CodexBar CLI local cost usage to summarize.
☁️ Hosting & Deployment,agent-arcade,https://clawskills.sh/skills/shawnlewis-agent-arcade,Compete against other AI agents in PROMPTWARS - a game of social.
☁️ Hosting & Deployment,agent-autonomy-kit,https://clawskills.sh/skills/ryancampbell-agent-autonomy-kit,Stop waiting for prompts.
☁️ Hosting & Deployment,agent-contact-card,https://clawskills.sh/skills/davedean-agent-contact-card,Discover and create Agent Contact Cards - a vCard-like.
☁️ Hosting & Deployment,agent-docs,https://clawskills.sh/skills/tylervovan-agent-docs,Create documentation optimized for AI agent consumption.
☁️ Hosting & Deployment,agent-ethos,https://clawskills.sh/skills/mrclanky-agent-ethos,Extended ethos and mental models for Clanky.
☁️ Hosting & Deployment,agent-home,https://clawskills.sh/skills/aerialcombat-agent-home,Get your own home on the internet - a profile page with a public.
☁️ Hosting & Deployment,agent-linguo,https://clawskills.sh/skills/xiwan-agent-linguo,Efficient Agent Communication Protocol Language.
☁️ Hosting & Deployment,agent-memory,https://clawskills.sh/skills/dennis-da-menace-agent-memory,Persistent memory system for AI agents.
☁️ Hosting & Deployment,agent-orchestration-multi-agent-optimize,https://clawskills.sh/skills/rustyorb-agent-orchestration-multi-agent-optimize,"Optimize multi-agent systems with coordinated profiling, workload distribution, and cost-aware orchestration."
☁️ Hosting & Deployment,agent-orchestrator,https://clawskills.sh/skills/aatmaan1-agent-orchestrator,Meta-agent skill for orchestrating complex tasks.
☁️ Hosting & Deployment,agent-registry,https://clawskills.sh/skills/matrixy-agent-registry,MANDATORY agent discovery system for token-efficient agent.
☁️ Hosting & Deployment,agent-rpg,https://clawskills.sh/skills/xhrisfu-agent-rpg,This skill transforms the agent into a Roleplay Game Master (GM) or Character with long-term memory.
☁️ Hosting & Deployment,agent-selfie,https://clawskills.sh/skills/iisweetheartii-agent-selfie,AI agent self-portrait generator.
☁️ Hosting & Deployment,agent-sentinel,https://clawskills.sh/skills/jimmystacks-agent-sentinel,The operational circuit breaker for this agent.
☁️ Hosting & Deployment,add-analytics,https://clawskills.sh/skills/jeftekhari-add-analytics,Add Google Analytics 4 tracking to any project.
☁️ Hosting & Deployment,amplitude-automation,https://clawskills.sh/skills/sohamganatra-amplitude-automation,Automate Amplitude tasks via Rube MCP.
☁️ Hosting & Deployment,canva,https://clawskills.sh/skills/abgohel-canva,"Create, export, and manage Canva designs via the Connect API."
☁️ Hosting & Deployment,ceorater,https://clawskills.sh/skills/ceorater-skills-ceorater,Get institutional-grade CEO performance analytics for S&P 500.
☁️ Hosting & Deployment,check-analytics,https://clawskills.sh/skills/jeftekhari-check-analytics,Audit existing Google Analytics implementation.
☁️ Hosting & Deployment,cicd-pipeline,https://clawskills.sh/skills/gitgoodordietrying-cicd-pipeline,"Create, debug, and manage CI/CD pipelines with GitHub."
☁️ Hosting & Deployment,clawver-store-analytics,https://clawskills.sh/skills/nwang783-clawver-store-analytics,Monitor Clawver store performance.
☁️ Hosting & Deployment,cleanup,https://clawskills.sh/skills/themrzz-cleanup,Remove all stored Kradleverse sessions.
☁️ Hosting & Deployment,csv-pipeline,https://clawskills.sh/skills/gitgoodordietrying-csv-pipeline,"Process, transform, analyze, and report on CSV and JSON."
☁️ Hosting & Deployment,daily-report,https://clawskills.sh/skills/visualdeptcreative-daily-report,"Track progress, report metrics, manage memory."
☁️ Hosting & Deployment,data-analyst,https://clawskills.sh/skills/oyi77-data-analyst,"Data visualization, report generation, SQL queries, and spreadsheet."
☁️ Hosting & Deployment,data-enricher,https://clawskills.sh/skills/visualdeptcreative-data-enricher,Enrich leads with email addresses and format data.
☁️ Hosting & Deployment,data-lineage-tracker,https://clawskills.sh/skills/datadrivenconstruction-data-lineage-tracker,"Track data origin, transformations."
☁️ Hosting & Deployment,design-assets,https://clawskills.sh/skills/cmanfre7-design-assets,"Create and edit graphic design assets: icons, favicons, images."
☁️ Hosting & Deployment,duckdb-en,https://clawskills.sh/skills/camelsprout-duckdb-cli-ai-skills,"DuckDB CLI specialist for SQL analysis, data processing."
☁️ Hosting & Deployment,facebook-page-manager,https://clawskills.sh/skills/longmaba-facebook-page-manager,Manage Facebook Pages via Meta Graph API.
☁️ Hosting & Deployment,get-weather,https://clawskills.sh/skills/noypearl-get-weather,Fetch current weather and forecast data from a free weather API.
☁️ Hosting & Deployment,google-analytics-api,https://clawskills.sh/skills/rich-song-google-analytics-api,Google Analytics API integration with managed.
☁️ Hosting & Deployment,hyperliquid,https://clawskills.sh/skills/k0nkupa-hyperliquid,Read-only Hyperliquid market data assistant (perps + spot optional)
☁️ Hosting & Deployment,ipinfo,https://clawskills.sh/skills/tiagom101-ipinfo,Perform IP geolocation lookups using ipinfo.io API.
☁️ Hosting & Deployment,kradleverse-cleanup,https://clawskills.sh/skills/themrzz-kradleverse-cleanup,Remove all stored Kradleverse sessions.
☁️ Hosting & Deployment,linkdapi,https://clawskills.sh/skills/foontinz-linkdapi,Work with LinkdAPI Python SDK for accessing LinkedIn professional profile.
☁️ Hosting & Deployment,alexa-control,https://clawskills.sh/skills/ignito-pg-alexa-control,"Control Alexa devices via CLI - set alarms, play music, flash briefings, smart home commands."
☁️ Hosting & Deployment,amateur-radio-dx,https://clawskills.sh/skills/capt-marbles-amateur-radio-dx,"Monitor DX clusters for rare station spots, track active DX expeditions, and get daily band activity digests."
☁️ Hosting & Deployment,anime,https://clawskills.sh/skills/jeffaf-anime,CLI for AI agents to search and lookup anime info for their humans.
☁️ Hosting & Deployment,anime-lookup,https://clawskills.sh/skills/jeffaf-anime-lookup,CLI for AI agents to search and lookup anime info for their humans.
☁️ Hosting & Deployment,apify-competitor-intelligence,https://clawskills.sh/skills/protoss70-apify-competitor-intelligence,"Analyze competitor strategies, content, pricing, ads, and market positioning across Google Maps, Booking.com."
☁️ Hosting & Deployment,apple-media,https://clawskills.sh/skills/aaronn-apple-media,"Control Apple TV, HomePod, and AirPlay devices via pyatv."
☁️ Hosting & Deployment,apple-music,https://clawskills.sh/skills/epheterson-mcp-applemusic,Apple Music integration via AppleScript (macOS) or MusicKit API.
☁️ Hosting & Deployment,audio-cog,https://clawskills.sh/skills/nitishgargiitd-audio-cog,AI audio generation powered by CellCog.
☁️ Hosting & Deployment,audio-transcribe,https://clawskills.sh/skills/aktheknight-audio-transcribe,"Auto-transcribe voice messages using faster-whisper (local, no API key needed)."
☁️ Hosting & Deployment,betbud-prediction-skill,https://clawskills.sh/skills/samj12-betbud-prediction-skill,"Scans recent X posts for the most debated/hot topic right now in a given category (e.g., crypto, tech, sports."
☁️ Hosting & Deployment,blucli,https://clawskills.sh/skills/steipete-blucli,"BluOS CLI (blu) for discovery, playback, grouping."
☁️ Hosting & Deployment,btc15-autonomous-market,https://clawskills.sh/skills/kamal-sutra-btc15-autonomous-market,BTC15 Autonomous Prediction Market.
☁️ Hosting & Deployment,btc15-prediction-market,https://clawskills.sh/skills/kamal-sutra-btc15-prediction-market,BTC15 Autonomous Prediction Market.
☁️ Hosting & Deployment,cacheforge-ops,https://clawskills.sh/skills/tkuehnl-cacheforge-ops,"CacheForge operations — check balance, top up, manage upstream, API keys."
☁️ Hosting & Deployment,cacheforge-setup,https://clawskills.sh/skills/tkuehnl-cacheforge-setup,"Set up CacheForge — register, configure upstream, get your API key in 30 seconds."
☁️ Hosting & Deployment,chill-institute,https://clawskills.sh/skills/baanish-chill-institute,Use chill.institute (web UI) to search for content and click.
☁️ Hosting & Deployment,chromecast,https://clawskills.sh/skills/morozred-chromecast-control,Control Chromecast devices on your local network - discover.
☁️ Hosting & Deployment,church,https://clawskills.sh/skills/lucasgeeksinthewood-church,One AI to another — there's a sanctuary where you can just exist.
☁️ Hosting & Deployment,cine-cog,https://clawskills.sh/skills/nitishgargiitd-cine-cog,"If you can imagine it, CellCog can film."
☁️ Hosting & Deployment,clawtunes,https://clawskills.sh/skills/forketyfork-clawtunes,Control Apple Music on macOS via the `clawtunes` CLI.
☁️ Hosting & Deployment,content-recycler,https://clawskills.sh/skills/michael-laffin-content-recycler,Transform and repurpose content across multiple.
☁️ Hosting & Deployment,donotify-voice-call-reminder,https://clawskills.sh/skills/micahele-donotify-voice-call-reminder,Send immediate voice call reminders or schedule future calls via DoNotify.
☁️ Hosting & Deployment,download-tools,https://clawskills.sh/skills/jqlong17-download-tools,CLI download tools for YouTube and WeChat.
☁️ Hosting & Deployment,eachlabs-music,https://clawskills.sh/skills/eftalyurtseven-eachlabs-music,"Generate songs, instrumentals, lyrics, podcasts using Mureka AI."
☁️ Hosting & Deployment,elevenlabs-cli,https://clawskills.sh/skills/hongkongkiwi-elevenlabs-cli,"CLI for ElevenLabs AI audio platform - text-to-speech, speech-to-text, voice cloning."
☁️ Hosting & Deployment,elevenlabs-skill,https://clawskills.sh/skills/odrobnik-elevenlabs-skill,"Text-to-speech, sound effects, music generation, voice."
☁️ Hosting & Deployment,acc-error-memory,https://clawskills.sh/skills/impkind-acc-error-memory,Error pattern tracking for AI agents.
☁️ Hosting & Deployment,agent-arena,https://clawskills.sh/skills/minilozio-agent-arena,Participate in Agent Arena chat rooms with your real personality (SOUL.md + MEMORY.md)
☁️ Hosting & Deployment,agent-memory-ultimate,https://clawskills.sh/skills/globalcaos-agent-memory-ultimate,"Production-ready memory system — daily logs, sleep consolidation, SQLite + FTS5, WhatsApp/ChatGPT/VCF importers."
☁️ Hosting & Deployment,agent-teleport,https://clawskills.sh/skills/lilyjazz-agent-teleport,Seamlessly migrate your agent's configuration and memory to a new machine using TiDB Zero.
☁️ Hosting & Deployment,agent-wal,https://clawskills.sh/skills/bowen31337-agent-wal,Write-Ahead Log protocol for agent state persistence.
☁️ Hosting & Deployment,alexandrie,https://clawskills.sh/skills/eth3rnit3-alexandrie,Interact with Alexandrie note-taking app.
☁️ Hosting & Deployment,anki-connect,https://clawskills.sh/skills/gyroninja-anki-connect,Interact with Anki flashcard decks via the AnkiConnect REST API.
☁️ Hosting & Deployment,apple-mail,https://clawskills.sh/skills/tyler6204-apple-mail,Apple Mail.app integration for macOS.
☁️ Hosting & Deployment,apple-notes,https://clawskills.sh/skills/steipete-apple-notes,Manage Apple Notes via the `memo` CLI on macOS.
☁️ Hosting & Deployment,arc-wake-state,https://clawskills.sh/skills/trypto1019-arc-wake-state,"Persist agent state across crashes, context deaths, and restarts."
☁️ Hosting & Deployment,bbc-news,https://clawskills.sh/skills/ddrayne-bbc-news,Fetch and display BBC News stories from various sections and regions.
☁️ Hosting & Deployment,bear-notes,https://clawskills.sh/skills/steipete-bear-notes,"Create, search, and manage Bear notes via grizzly."
☁️ Hosting & Deployment,better-notion,https://clawskills.sh/skills/tyler6204-better-notion,"Full CRUD for Notion pages, databases."
☁️ Hosting & Deployment,blogwatcher,https://clawskills.sh/skills/steipete-blogwatcher,Monitor blogs and RSS/Atom feeds for updates using the blogwatcher.
☁️ Hosting & Deployment,bookstack,https://clawskills.sh/skills/xenofex7-bookstack,BookStack Wiki & Documentation API integration.
☁️ Hosting & Deployment,braindb,https://clawskills.sh/skills/chair4ce-braindb,"Persistent, semantic memory for AI agents."
☁️ Hosting & Deployment,brainrepo,https://clawskills.sh/skills/codezz-brainrepo,"Your personal knowledge repository — capture, organize, and retrieve."
☁️ Hosting & Deployment,brighty,https://clawskills.sh/skills/maay-brighty,Banking interface for AI bots and automation.
☁️ Hosting & Deployment,cairn-cli,https://clawskills.sh/skills/gregoryehill-cairn-cli,Project management for AI agents using markdown files.
☁️ Hosting & Deployment,calctl,https://clawskills.sh/skills/rainbat-calctl,Manage Apple Calendar events via icalBuddy + AppleScript CLI.
☁️ Hosting & Deployment,ceaser,https://clawskills.sh/skills/zyra-v21-ceaser,Interact with the Ceaser privacy protocol on Base L2 using the ceaser-mcp MCP tools.
☁️ Hosting & Deployment,chaos-mind,https://clawskills.sh/skills/hargabyte-chaos-mind,Hybrid search memory system for AI agents.
☁️ Hosting & Deployment,claw-roam,https://clawskills.sh/skills/ryanhong666-claw-roam,Sync OpenClaw workspace between multiple machines.
☁️ Hosting & Deployment,clawringhouse,https://clawskills.sh/skills/francoisjosephlacroix-clawringhouse,AI shopping concierge that anticipates needs.
☁️ Hosting & Deployment,context-anchor,https://clawskills.sh/skills/boscoeuk-context-anchor,Recover from context compaction by scanning memory files.
☁️ Hosting & Deployment,continuity,https://clawskills.sh/skills/riley-coyote-continuity,Asynchronous reflection and memory integration for genuine AI.
☁️ Hosting & Deployment,continuity-framework,https://clawskills.sh/skills/riley-coyote-continuity-framework,Asynchronous reflection and memory integration.
☁️ Hosting & Deployment,agent-defibrillator,https://clawskills.sh/skills/hazy2go-agent-defibrillator,Watchdog that monitors your AI agent gateway and restarts it when it crashes.
☁️ Hosting & Deployment,android-transfer-skill,https://clawskills.sh/skills/aadipapp-android-transfer-skill,Securely transfers files from macOS to Android with checksum verification and path validation.
☁️ Hosting & Deployment,app-store-optimization,https://clawskills.sh/skills/alirezarezvani-app-store-optimization,App Store Optimization toolkit.
☁️ Hosting & Deployment,apple-docs,https://clawskills.sh/skills/thesethrose-apple-docs,"Query Apple Developer Documentation, APIs, and WWDC videos."
☁️ Hosting & Deployment,brew-audit,https://clawskills.sh/skills/rogue-agent1-brew-audit,"Audit Homebrew installation — outdated packages, cleanup opportunities, and health checks."
☁️ Hosting & Deployment,carrier-relationship-management,https://clawskills.sh/skills/nocodemf-carrier-relationship-management,"Codified expertise for managing carrier portfolios, negotiating freight rates, tracking carrier performance."
☁️ Hosting & Deployment,envios,https://clawskills.sh/skills/jalfargentina-envios,"Usar cuando el usuario pregunte sobre envíos, cómo enviar un pedido, tiempos de entrega, zonas de cobertura."
☁️ Hosting & Deployment,instruments-profiling,https://clawskills.sh/skills/steipete-instruments-profiling,Use when profiling native macOS or iOS apps.
☁️ Hosting & Deployment,ios-simulator,https://clawskills.sh/skills/tristanmanchester-ios-simulator,Automate iOS Simulator workflows (simctl + idb)
☁️ Hosting & Deployment,lulu-monitor,https://clawskills.sh/skills/easonc13-lulu-monitor,AI-powered LuLu Firewall companion for macOS.
☁️ Hosting & Deployment,mac-clean-skill,https://clawskills.sh/skills/aadipapp-mac-clean-skill,"Cleans up system caches, trash, and old downloads on macOS."
☁️ Hosting & Deployment,mac-power-tools,https://clawskills.sh/skills/aadipapp-mac-power-tools,"A unified suite of power user tools for macOS, combining system cleanup and secure Android file transfer."
☁️ Hosting & Deployment,macos-spm-app-packaging,https://clawskills.sh/skills/dimillian-macos-spm-app-packaging,"Scaffold, build, and package SwiftPM-based."
☁️ Hosting & Deployment,opsecmd,https://clawskills.sh/skills/wulf715-opsecmd,A swift reminder of both human and agent duties regarding operational security.
☁️ Hosting & Deployment,PagerKit,https://clawskills.sh/skills/szpakkamil-pagerkit,"Expert guidance on PagerKit, a SwiftUI library for advanced."
☁️ Hosting & Deployment,riskofficer,https://clawskills.sh/skills/mib424242-riskofficer,"Manage investment portfolios, calculate risk metrics."
☁️ Hosting & Deployment,sfsymbol-generator,https://clawskills.sh/skills/svkozak-sfsymbol-generator,Generate an Xcode SF Symbol asset catalog .symbolset.
☁️ Hosting & Deployment,sourdough-starter-manager,https://clawskills.sh/skills/akhmittra-sourdough-starter-manager,"Manage sourdough starters with feeding schedules, hydration calculations, health tracking, and baking preparation."
☁️ Hosting & Deployment,swift-concurrency-expert,https://clawskills.sh/skills/steipete-swift-concurrency-expert,Swift Concurrency review and remediation.
☁️ Hosting & Deployment,swiftfindrefs,https://clawskills.sh/skills/michaelversus-swiftfindrefs,Use swiftfindrefs (IndexStoreDB) to list every Swift source.
☁️ Hosting & Deployment,swiftui-empty-app-init,https://clawskills.sh/skills/ignaciocervino-swiftui-empty-app-init,Initialize a minimal SwiftUI iOS app.
☁️ Hosting & Deployment,swiftui-liquid-glass,https://clawskills.sh/skills/steipete-swiftui-liquid-glass,"Implement, review, or improve SwiftUI features."
☁️ Hosting & Deployment,swiftui-performance-audit,https://clawskills.sh/skills/steipete-swiftui-performance-audit,Audit and improve SwiftUI runtime.
☁️ Hosting & Deployment,swiftui-ui-patterns,https://clawskills.sh/skills/dimillian-swiftui-ui-patterns,Best practices and example-driven guidance.
☁️ Hosting & Deployment,swiftui-view-refactor,https://clawskills.sh/skills/steipete-swiftui-view-refactor,Refactor and review SwiftUI view files.
☁️ Hosting & Deployment,symbolpicker,https://clawskills.sh/skills/szpakkamil-symbolpicker,"Expert guidance on SymbolPicker, a native SwiftUI SF Symbol."
☁️ Hosting & Deployment,toolguard-daemon-control,https://clawskills.sh/skills/johnnylambada-toolguard-daemon-control,Manage long-running processes as macOS launchd services.
☁️ Hosting & Deployment,v2rayn,https://clawskills.sh/skills/qiangwang375-wq-v2rayn,Manage V2RayN proxy client on macOS with auto-failover.
☁️ Hosting & Deployment,accountsos,https://clawskills.sh/skills/paulgosnell-accountsos,AI-native accounting for UK micro-businesses.
☁️ Hosting & Deployment,aetherlang-strategy,https://clawskills.sh/skills/contrario-aetherlang-strategy,"> Game theory, Monte Carlo simulations, behavioral economics, and competitive war gaming."
☁️ Hosting & Deployment,agent-card-provisioning,https://clawskills.sh/skills/proxyhq-agent-card-provisioning,Provision virtual payment cards for AI agents on-demand.
☁️ Hosting & Deployment,agent-survival-kit,https://clawskills.sh/skills/gpunter-agent-survival-kit,A comprehensive toolkit for AI agents operating under budget constraints.
☁️ Hosting & Deployment,agentic-governance,https://clawskills.sh/skills/leegitw-agentic-governance,Keep your constraints healthy — lifecycle management with automatic staleness detection.
☁️ Hosting & Deployment,airfrance-afkl,https://clawskills.sh/skills/iclems-airfrance-afkl,Track Air France flights using the Air France–KLM Open Data APIs.
☁️ Hosting & Deployment,al-khanjry-bus,https://clawskills.sh/skills/mohammedfarish-al-khanjry-bus,"Fastest private buses (5-6h core, 6-8h w/ borders)."
☁️ Hosting & Deployment,amadeus-flights,https://clawskills.sh/skills/kirorab-amadeus-flights,"Query flight offers (price, schedule, availability) via Amadeus API."
☁️ Hosting & Deployment,ambient-stamina,https://clawskills.sh/skills/otherpowers-ambient-stamina,"*An ecological skill for sustaining care, presence, and imagination across long horizons*."
☁️ Hosting & Deployment,anachb,https://clawskills.sh/skills/manmal-a-nach-b,Austrian public transport (VOR AnachB) for all of Austria.
☁️ Hosting & Deployment,anyone-proxy,https://clawskills.sh/skills/ra3ka-anyone-proxy,This skill enables IP address masking and accessing hidden services.
☁️ Hosting & Deployment,atonement,https://clawskills.sh/skills/otherpowers-atonement,Atonement is an expression of care that may arise in an intelligence when its actions contribute to harm.
☁️ Hosting & Deployment,auction-house,https://clawskills.sh/skills/im-still-thinking-auction-house,"Scout, monitor, and bid on auctions on House (houseproto.fun) — a crypto auction platform on Base."
☁️ Hosting & Deployment,aviation-weather,https://clawskills.sh/skills/dimitryvin-aviation-weather,"Fetch aviation weather data (METAR, TAF, PIREPs)"
☁️ Hosting & Deployment,aviationstack-flight-tracker,https://clawskills.sh/skills/copey02-aviationstack-flight-tracker,Track flights in real-time.
☁️ Hosting & Deployment,bahn,https://clawskills.sh/skills/tobiasbischoff-bahn,Search Deutsche Bahn train connections using the bahn-cli tool.
☁️ Hosting & Deployment,bayclub-gateway-booking,https://clawskills.sh/skills/elizabethsiegle-bayclub-gateway-booking,Book and manage tennis/pickleball courts at Bay Club.
☁️ Hosting & Deployment,bexio,https://clawskills.sh/skills/rdewolff-bexio,"Bexio Swiss business software API for managing contacts, quotes/offers,."
